{"artifact_type":"deck_delivery_decision","deck_id":"D03","delivered_pptx_sha256":"c50d82fd37b2b41880b0eb162e1ad68cd9865ae0e325de37abaa6a206158f81e","p4_candidate_report_sha256":"f6c7c700300694186b11cbe341b1f0574597576dc72a0321ea7cf3ee1b9ce334","policy_summary":{"critical":0,"major":0,"minor":0,"review_incomplete":0,"unexpected_reviewer_calls":0},"references":{"deck_consistency_report_sha256":"fc00fb90f1bc5515d8d2128d59d928ee22b601ab555789ccd3d405b9527029fb","exception_review_hashes":[],"qa_report_sha256":"1a9e338c1d7daf3fc35280c5b0d70f0b92d38a2498b283a207e48cccf29819de","roundtrip_report_sha256":"0a124245d667a2d8d5e97a4fad044fc0235a33a38214a65e8a85dc19f1f744b8"},"schema_version":"1.0","status":"pass","upstream_revision":null,"warning_approval":null}
